{
  "schemaVersion": 1,
  "updatedAt": "2026-08-11T21:10:00+05:00",
  "methodNoteZh": "以下数字仅用于测试商业模型敏感性，是情景假设，不是市场规模、销量或收益预测。",
  "items": [
    {
      "id": "chinese-language-university-pathway",
      "number": "IDEA 01",
      "titleZh": "中文课程 + 中国高校升学路径",
      "subtitleZh": "从语言学习延伸到申请准备、院校匹配与行前辅导",
      "hypothesis": "如果为哈萨克斯坦中学生、大学生和家长提供分级中文课程，并把合格学员衔接至中国高校申请与行前准备，就可能形成课程费、申请辅导费和合作服务费组合。",
      "targetCustomers": [
        "准备学习中文的中学生与大学生",
        "关注中国高校本科、硕士或奖学金项目的家庭",
        "需要员工中文培训的本地企业"
      ],
      "validationSteps": [
        "访谈30个家庭、10所学校与5家中哈业务企业，验证付费意愿和目标城市",
        "先开设两期8周小班，仅在达到最低付费人数后开班",
        "与具备资质和公开招生信息的中国高校或官方招生渠道核验合作边界",
        "跟踪试听转化、续费、HSK报名和申请材料完成率"
      ],
      "risks": [
        "不得承诺录取、奖学金、签证或毕业结果",
        "教师资质、未成年人保护、数据跨境和招生宣传须符合两国最新规定",
        "招生季节性与家长支付能力可能造成班级利用率波动"
      ],
      "chart": {
        "kind": "scenario-not-forecast",
        "titleZh": "6个月试点情景",
        "unitZh": "月度情景值",
        "labels": ["第1月", "第2月", "第3月", "第4月", "第5月", "第6月"],
        "series": [
          {
            "nameZh": "付费学员（人）",
            "format": "integer",
            "values": [12, 18, 28, 40, 52, 64]
          },
          {
            "nameZh": "情景收入（万₸）",
            "format": "decimal",
            "values": [84, 126, 196, 280, 364, 448]
          }
        ],
        "assumptionsZh": "示例按每名学员每月7万坚戈课程收入计算，未扣教师、教室、营销、税费、退款和申请服务成本。"
      },
      "flow": [
        { "titleZh": "市场验证", "detailZh": "访谈、候补名单、付费定金" },
        { "titleZh": "语言课程", "detailZh": "分级测试、小班授课、HSK路径" },
        { "titleZh": "升学准备", "detailZh": "院校筛选、材料清单、时间表" },
        { "titleZh": "行前支持", "detailZh": "不承诺录取或签证结果" }
      ],
      "ctaZh": "验证教育项目",
      "ctaSubject": "中文课程与中国高校升学路径项目"
    },
    {
      "id": "china-market-entry-localization-desk",
      "number": "IDEA 02",
      "titleZh": "中国企业哈萨克斯坦落地与本地化服务台",
      "subtitleZh": "把翻译、市场访谈、供应商筛选与行政协调打包成阶段性服务",
      "hypothesis": "如果先用固定范围的付费市场验证包帮助中国中小企业核验客户、伙伴、城市与合规路径，再按需转入月度本地协调，就可能减少客户在尚未验证需求时直接设立重资产团队的风险。",
      "targetCustomers": [
        "正在评估哈萨克斯坦市场的中国制造与服务企业",
        "需要中文沟通、资料本地化与现场协调的项目团队",
        "希望比较阿斯塔纳、阿拉木图、奇姆肯特或区域工业城市的企业"
      ],
      "validationSteps": [
        "定义一个不超过4周的付费发现包及明确交付物",
        "邀请10家目标企业评审报价和交付范围，争取3个付费试点",
        "记录从首次沟通到签约、访谈完成与后续委托的转化漏斗",
        "为法律、税务、审计、许可与海关事项建立持牌合作方转介边界"
      ],
      "risks": [
        "不同产业的许可、认证、制裁与原产地要求差异很大",
        "翻译与协调不能替代持牌法律、税务、审计或海关服务",
        "项目收入可能高度依赖少数客户，需限制无边界的免费咨询"
      ],
      "chart": {
        "kind": "scenario-not-forecast",
        "titleZh": "6个月销售漏斗情景",
        "unitZh": "月度情景值",
        "labels": ["第1月", "第2月", "第3月", "第4月", "第5月", "第6月"],
        "series": [
          {
            "nameZh": "付费项目（个）",
            "format": "integer",
            "values": [1, 2, 2, 3, 4, 5]
          },
          {
            "nameZh": "情景收入（万₸）",
            "format": "decimal",
            "values": [120, 240, 300, 420, 560, 700]
          }
        ],
        "assumptionsZh": "收入仅为发现包与协调服务的示例组合，未扣人员、差旅、翻译、合作方、税费和获客成本。"
      },
      "flow": [
        { "titleZh": "需求筛选", "detailZh": "行业、产品、城市、期限" },
        { "titleZh": "付费验证", "detailZh": "访谈、桌面调研、风险清单" },
        { "titleZh": "落地路线", "detailZh": "伙伴、城市、预算和合规转介" },
        { "titleZh": "持续协调", "detailZh": "仅在验证后进入月度服务" }
      ],
      "ctaZh": "讨论市场验证包",
      "ctaSubject": "哈萨克斯坦市场进入与本地化服务台"
    }
  ]
}
